{
  "schema": "vland.recipe",
  "schemaVersion": 4,
  "title": "Уровни и ярусы",
  "mode": "tiers",
  "seed": 42,
  "generation": {
    "autoTransports": {
      "maxGroups": 1,
      "maxRoomsPerGroup": 3,
      "chance": 1,
      "travelCost": 1,
      "landingSize": 1,
      "types": {
        "teleport": 1,
        "lift": 1,
        "stairs": 1
      }
    },
    "layers": [
      {
        "id": "lower",
        "elevation": 0,
        "headroom": 3,
        "request": {
          "schema": "vland.request",
          "schemaVersion": 1,
          "rooms": {
            "count": 5
          },
          "search": {
            "candidates": 1
          }
        }
      },
      {
        "id": "upper",
        "elevation": 4,
        "headroom": 3,
        "request": {
          "schema": "vland.request",
          "schemaVersion": 1,
          "rooms": {
            "count": 5
          },
          "search": {
            "candidates": 1
          }
        }
      }
    ]
  },
  "catalog": [
    {
      "id": "chest",
      "name": "Сундук",
      "category": "items",
      "type": "container",
      "subtype": "default",
      "channel": "prop",
      "color": "#dfc77d",
      "glyph": "□",
      "footprint": {
        "width": 1,
        "height": 1
      },
      "blocking": false,
      "constraints": {
        "allowedEnvironments": [
          "land",
          "underground"
        ],
        "requiresWalkable": true,
        "requiresEmptyTile": true
      },
      "properties": {
        "contents": [],
        "lootTable": "default"
      }
    },
    {
      "id": "supply",
      "name": "Припасы",
      "category": "items",
      "type": "supplies",
      "subtype": "default",
      "channel": "prop",
      "color": "#a1c6db",
      "glyph": "▣",
      "footprint": {
        "width": 1,
        "height": 1
      },
      "blocking": false,
      "constraints": {
        "allowedEnvironments": [
          "land",
          "underground"
        ],
        "requiresWalkable": true,
        "requiresEmptyTile": true
      },
      "properties": {}
    },
    {
      "id": "guard",
      "name": "Охранник",
      "category": "fauna",
      "type": "human",
      "subtype": "security",
      "channel": "actor",
      "color": "#d88e7e",
      "glyph": "●",
      "footprint": {
        "width": 1,
        "height": 1
      },
      "blocking": false,
      "constraints": {
        "allowedEnvironments": [
          "land",
          "underground"
        ],
        "requiresWalkable": true,
        "requiresEmptyTile": true
      },
      "properties": {
        "aggression": "hostile"
      }
    },
    {
      "id": "beast",
      "name": "Пещерный зверь",
      "category": "fauna",
      "type": "monster",
      "subtype": "default",
      "channel": "actor",
      "color": "#cc9181",
      "glyph": "◆",
      "footprint": {
        "width": 1,
        "height": 1
      },
      "blocking": false,
      "constraints": {
        "allowedEnvironments": [
          "underground"
        ],
        "requiresWalkable": true,
        "requiresEmptyTile": true
      },
      "properties": {}
    },
    {
      "id": "boss",
      "name": "Крупное существо",
      "category": "fauna",
      "type": "monster",
      "subtype": "boss",
      "channel": "actor",
      "color": "#e47c95",
      "glyph": "✦",
      "footprint": {
        "width": 3,
        "height": 3
      },
      "blocking": false,
      "constraints": {
        "allowedEnvironments": [
          "land",
          "underground"
        ],
        "requiresWalkable": true,
        "requiresEmptyTile": true
      },
      "properties": {}
    },
    {
      "id": "traveler",
      "name": "Путешественник",
      "category": "fauna",
      "type": "human",
      "subtype": "neutral",
      "channel": "actor",
      "color": "#d9d2a3",
      "glyph": "○",
      "footprint": {
        "width": 1,
        "height": 1
      },
      "blocking": false,
      "constraints": {
        "allowedEnvironments": [
          "land",
          "underground"
        ],
        "requiresWalkable": true,
        "requiresEmptyTile": true
      },
      "properties": {}
    },
    {
      "id": "deer",
      "name": "Олень",
      "category": "fauna",
      "type": "mammal",
      "subtype": "default",
      "channel": "actor",
      "color": "#ccb087",
      "glyph": "○",
      "footprint": {
        "width": 1,
        "height": 1
      },
      "blocking": false,
      "constraints": {
        "allowedEnvironments": [
          "land"
        ],
        "requiresWalkable": true,
        "requiresEmptyTile": true,
        "allowedTerrain": [
          "soil",
          "snow"
        ]
      },
      "properties": {
        "aggression": "neutral",
        "activityRadius": 8
      }
    },
    {
      "id": "fish-fresh",
      "name": "Пресноводная рыба",
      "category": "fauna",
      "type": "fish",
      "subtype": "freshwater",
      "channel": "actor",
      "color": "#8dbed0",
      "glyph": "◁",
      "footprint": {
        "width": 1,
        "height": 1
      },
      "blocking": false,
      "constraints": {
        "allowedEnvironments": [
          "freshwater"
        ],
        "requiresWalkable": false,
        "requiresEmptyTile": true
      },
      "properties": {}
    },
    {
      "id": "fish-sea",
      "name": "Морская рыба",
      "category": "fauna",
      "type": "fish",
      "subtype": "saltwater",
      "channel": "actor",
      "color": "#7ab6cd",
      "glyph": "◁",
      "footprint": {
        "width": 1,
        "height": 1
      },
      "blocking": false,
      "constraints": {
        "allowedEnvironments": [
          "saltwater"
        ],
        "requiresWalkable": false,
        "requiresEmptyTile": true
      },
      "properties": {}
    },
    {
      "id": "bird",
      "name": "Птица",
      "category": "fauna",
      "type": "bird",
      "subtype": "default",
      "channel": "air",
      "color": "#c9d2c5",
      "glyph": "⌁",
      "footprint": {
        "width": 1,
        "height": 1
      },
      "blocking": false,
      "constraints": {
        "allowedEnvironments": [
          "air"
        ],
        "requiresWalkable": false,
        "requiresEmptyTile": true
      },
      "properties": {}
    },
    {
      "id": "bat",
      "name": "Летучая мышь",
      "category": "fauna",
      "type": "flying",
      "subtype": "default",
      "channel": "air",
      "color": "#af9dc6",
      "glyph": "⌁",
      "footprint": {
        "width": 1,
        "height": 1
      },
      "blocking": false,
      "constraints": {
        "allowedEnvironments": [
          "air"
        ],
        "allowedLayerKinds": [
          "underground",
          "dungeon",
          "tier"
        ],
        "requiresWalkable": false,
        "requiresEmptyTile": true
      },
      "properties": {}
    },
    {
      "id": "lever",
      "name": "Рычаг",
      "category": "objects",
      "type": "mechanism",
      "subtype": "default",
      "channel": "prop",
      "color": "#e8af74",
      "glyph": "⌐",
      "footprint": {
        "width": 1,
        "height": 1
      },
      "blocking": false,
      "constraints": {
        "allowedEnvironments": [
          "land",
          "underground"
        ],
        "requiresWalkable": true,
        "requiresEmptyTile": true
      },
      "properties": {
        "targetId": null,
        "action": "toggle"
      }
    },
    {
      "id": "pump",
      "name": "Насос",
      "category": "objects",
      "type": "mechanism",
      "subtype": "default",
      "channel": "prop",
      "color": "#7dc4cf",
      "glyph": "▤",
      "footprint": {
        "width": 1,
        "height": 1
      },
      "blocking": false,
      "constraints": {
        "allowedEnvironments": [
          "land",
          "underground"
        ],
        "requiresWalkable": true,
        "requiresEmptyTile": true
      },
      "properties": {
        "targetId": null,
        "action": "drain"
      }
    },
    {
      "id": "portal",
      "name": "Портал",
      "category": "objects",
      "type": "teleport",
      "subtype": "default",
      "channel": "prop",
      "color": "#81c7d4",
      "glyph": "◌",
      "footprint": {
        "width": 1,
        "height": 1
      },
      "blocking": false,
      "constraints": {
        "allowedEnvironments": [
          "land",
          "underground"
        ],
        "requiresWalkable": true,
        "requiresEmptyTile": true
      },
      "properties": {
        "transport": {
          "kind": "teleport",
          "bidirectional": true,
          "travelCost": 1
        }
      }
    },
    {
      "id": "stairs",
      "name": "Лестница",
      "category": "objects",
      "type": "transport",
      "subtype": "stairs",
      "channel": "prop",
      "color": "#c7ad87",
      "glyph": "≡",
      "footprint": {
        "width": 1,
        "height": 1
      },
      "blocking": false,
      "constraints": {
        "allowedEnvironments": [
          "land",
          "underground"
        ],
        "requiresWalkable": true,
        "requiresEmptyTile": true
      },
      "properties": {
        "transport": {
          "kind": "stairs",
          "bidirectional": true,
          "travelCost": 1
        }
      }
    },
    {
      "id": "lift",
      "name": "Лифт",
      "category": "objects",
      "type": "transport",
      "subtype": "lift",
      "channel": "prop",
      "color": "#8fbcc7",
      "glyph": "↕",
      "footprint": {
        "width": 1,
        "height": 1
      },
      "blocking": false,
      "constraints": {
        "allowedEnvironments": [
          "land",
          "underground"
        ],
        "requiresWalkable": true,
        "requiresEmptyTile": true
      },
      "properties": {
        "transport": {
          "kind": "lift",
          "bidirectional": true,
          "travelCost": 1
        }